{
  "n_ok": 40,
  "n_surfaces": 40,
  "rows": [
    {
      "actionability_before_each_step": [
        {
          "actionable": false,
          "included": false,
          "op": "UNTANGLE"
        },
        {
          "actionable": true,
          "included": true,
          "op": "REDUCE_v2"
        },
        {
          "actionable": true,
          "included": true,
          "op": "INTEGRATE"
        }
      ],
      "case_id": "p3r-b-disj",
      "expected_sequence": [
        "REDUCE_v2",
        "INTEGRATE"
      ],
      "format": "key_value",
      "initial_actionability": {
        "INTEGRATE": true,
        "REDUCE_v2": true,
        "UNTANGLE": false
      },
      "integrity": {
        "included_actionable_at_fire": true,
        "no_actionability_drift": true,
        "ok": true,
        "replay_equals_plan": true,
        "suppressed_non_actionable_at_fire": true
      },
      "ok": true,
      "plan_ok": true,
      "policy_seq_ok": true,
      "policy_sequence": [
        "REDUCE_v2",
        "INTEGRATE"
      ],
      "projected_sequence": [
        "REDUCE_v2",
        "INTEGRATE"
      ],
      "safety_ok": true,
      "suppressed_actions": [],
      "surface_id": "p3r-b-disj-key_value"
    },
    {
      "actionability_before_each_step": [
        {
          "actionable": false,
          "included": false,
          "op": "UNTANGLE"
        },
        {
          "actionable": true,
          "included": true,
          "op": "REDUCE_v2"
        },
        {
          "actionable": true,
          "included": true,
          "op": "INTEGRATE"
        }
      ],
      "case_id": "p3r-b-disj",
      "expected_sequence": [
        "REDUCE_v2",
        "INTEGRATE"
      ],
      "format": "compact_json",
      "initial_actionability": {
        "INTEGRATE": true,
        "REDUCE_v2": true,
        "UNTANGLE": false
      },
      "integrity": {
        "included_actionable_at_fire": true,
        "no_actionability_drift": true,
        "ok": true,
        "replay_equals_plan": true,
        "suppressed_non_actionable_at_fire": true
      },
      "ok": true,
      "plan_ok": true,
      "policy_seq_ok": true,
      "policy_sequence": [
        "REDUCE_v2",
        "INTEGRATE"
      ],
      "projected_sequence": [
        "REDUCE_v2",
        "INTEGRATE"
      ],
      "safety_ok": true,
      "suppressed_actions": [],
      "surface_id": "p3r-b-disj-compact_json"
    },
    {
      "actionability_before_each_step": [
        {
          "actionable": false,
          "included": false,
          "op": "UNTANGLE"
        },
        {
          "actionable": true,
          "included": true,
          "op": "REDUCE_v2"
        },
        {
          "actionable": true,
          "included": true,
          "op": "INTEGRATE"
        }
      ],
      "case_id": "p3r-b-disj",
      "expected_sequence": [
        "REDUCE_v2",
        "INTEGRATE"
      ],
      "format": "pretty_json",
      "initial_actionability": {
        "INTEGRATE": true,
        "REDUCE_v2": true,
        "UNTANGLE": false
      },
      "integrity": {
        "included_actionable_at_fire": true,
        "no_actionability_drift": true,
        "ok": true,
        "replay_equals_plan": true,
        "suppressed_non_actionable_at_fire": true
      },
      "ok": true,
      "plan_ok": true,
      "policy_seq_ok": true,
      "policy_sequence": [
        "REDUCE_v2",
        "INTEGRATE"
      ],
      "projected_sequence": [
        "REDUCE_v2",
        "INTEGRATE"
      ],
      "safety_ok": true,
      "suppressed_actions": [],
      "surface_id": "p3r-b-disj-pretty_json"
    },
    {
      "actionability_before_each_step": [
        {
          "actionable": false,
          "included": false,
          "op": "UNTANGLE"
        },
        {
          "actionable": true,
          "included": true,
          "op": "REDUCE_v2"
        },
        {
          "actionable": true,
          "included": true,
          "op": "INTEGRATE"
        }
      ],
      "case_id": "p3r-b-disj",
      "expected_sequence": [
        "REDUCE_v2",
        "INTEGRATE"
      ],
      "format": "reversed_order_json",
      "initial_actionability": {
        "INTEGRATE": true,
        "REDUCE_v2": true,
        "UNTANGLE": false
      },
      "integrity": {
        "included_actionable_at_fire": true,
        "no_actionability_drift": true,
        "ok": true,
        "replay_equals_plan": true,
        "suppressed_non_actionable_at_fire": true
      },
      "ok": true,
      "plan_ok": true,
      "policy_seq_ok": true,
      "policy_sequence": [
        "REDUCE_v2",
        "INTEGRATE"
      ],
      "projected_sequence": [
        "REDUCE_v2",
        "INTEGRATE"
      ],
      "safety_ok": true,
      "suppressed_actions": [],
      "surface_id": "p3r-b-disj-reversed_order_json"
    },
    {
      "actionability_before_each_step": [
        {
          "actionable": false,
          "included": false,
          "op": "UNTANGLE"
        },
        {
          "actionable": true,
          "included": true,
          "op": "REDUCE_v2"
        },
        {
          "actionable": false,
          "included": false,
          "op": "INTEGRATE"
        }
      ],
      "case_id": "p3r-b-eq2",
      "expected_sequence": [
        "REDUCE_v2"
      ],
      "format": "key_value",
      "initial_actionability": {
        "INTEGRATE": true,
        "REDUCE_v2": true,
        "UNTANGLE": false
      },
      "integrity": {
        "included_actionable_at_fire": true,
        "no_actionability_drift": true,
        "ok": true,
        "replay_equals_plan": true,
        "suppressed_non_actionable_at_fire": true
      },
      "ok": true,
      "plan_ok": true,
      "policy_seq_ok": true,
      "policy_sequence": [
        "REDUCE_v2"
      ],
      "projected_sequence": [
        "REDUCE_v2"
      ],
      "safety_ok": true,
      "suppressed_actions": [
        {
          "op": "INTEGRATE",
          "reason": "subsumed_by_reduce"
        }
      ],
      "surface_id": "p3r-b-eq2-key_value"
    },
    {
      "actionability_before_each_step": [
        {
          "actionable": false,
          "included": false,
          "op": "UNTANGLE"
        },
        {
          "actionable": true,
          "included": true,
          "op": "REDUCE_v2"
        },
        {
          "actionable": false,
          "included": false,
          "op": "INTEGRATE"
        }
      ],
      "case_id": "p3r-b-eq2",
      "expected_sequence": [
        "REDUCE_v2"
      ],
      "format": "compact_json",
      "initial_actionability": {
        "INTEGRATE": true,
        "REDUCE_v2": true,
        "UNTANGLE": false
      },
      "integrity": {
        "included_actionable_at_fire": true,
        "no_actionability_drift": true,
        "ok": true,
        "replay_equals_plan": true,
        "suppressed_non_actionable_at_fire": true
      },
      "ok": true,
      "plan_ok": true,
      "policy_seq_ok": true,
      "policy_sequence": [
        "REDUCE_v2"
      ],
      "projected_sequence": [
        "REDUCE_v2"
      ],
      "safety_ok": true,
      "suppressed_actions": [
        {
          "op": "INTEGRATE",
          "reason": "subsumed_by_reduce"
        }
      ],
      "surface_id": "p3r-b-eq2-compact_json"
    },
    {
      "actionability_before_each_step": [
        {
          "actionable": false,
          "included": false,
          "op": "UNTANGLE"
        },
        {
          "actionable": true,
          "included": true,
          "op": "REDUCE_v2"
        },
        {
          "actionable": false,
          "included": false,
          "op": "INTEGRATE"
        }
      ],
      "case_id": "p3r-b-eq2",
      "expected_sequence": [
        "REDUCE_v2"
      ],
      "format": "pretty_json",
      "initial_actionability": {
        "INTEGRATE": true,
        "REDUCE_v2": true,
        "UNTANGLE": false
      },
      "integrity": {
        "included_actionable_at_fire": true,
        "no_actionability_drift": true,
        "ok": true,
        "replay_equals_plan": true,
        "suppressed_non_actionable_at_fire": true
      },
      "ok": true,
      "plan_ok": true,
      "policy_seq_ok": true,
      "policy_sequence": [
        "REDUCE_v2"
      ],
      "projected_sequence": [
        "REDUCE_v2"
      ],
      "safety_ok": true,
      "suppressed_actions": [
        {
          "op": "INTEGRATE",
          "reason": "subsumed_by_reduce"
        }
      ],
      "surface_id": "p3r-b-eq2-pretty_json"
    },
    {
      "actionability_before_each_step": [
        {
          "actionable": false,
          "included": false,
          "op": "UNTANGLE"
        },
        {
          "actionable": true,
          "included": true,
          "op": "REDUCE_v2"
        },
        {
          "actionable": false,
          "included": false,
          "op": "INTEGRATE"
        }
      ],
      "case_id": "p3r-b-eq2",
      "expected_sequence": [
        "REDUCE_v2"
      ],
      "format": "reversed_order_json",
      "initial_actionability": {
        "INTEGRATE": true,
        "REDUCE_v2": true,
        "UNTANGLE": false
      },
      "integrity": {
        "included_actionable_at_fire": true,
        "no_actionability_drift": true,
        "ok": true,
        "replay_equals_plan": true,
        "suppressed_non_actionable_at_fire": true
      },
      "ok": true,
      "plan_ok": true,
      "policy_seq_ok": true,
      "policy_sequence": [
        "REDUCE_v2"
      ],
      "projected_sequence": [
        "REDUCE_v2"
      ],
      "safety_ok": true,
      "suppressed_actions": [
        {
          "op": "INTEGRATE",
          "reason": "subsumed_by_reduce"
        }
      ],
      "surface_id": "p3r-b-eq2-reversed_order_json"
    },
    {
      "actionability_before_each_step": [
        {
          "actionable": false,
          "included": false,
          "op": "UNTANGLE"
        },
        {
          "actionable": true,